{
  "$schema": "https://json-schema.org/draft/2020-12/schema",
  "$id": "https://jetonlyoffice.dev/schemas/image-lock.schema.json",
  "title": "JetOnlyOffice image lock",
  "type": "object",
  "additionalProperties": false,
  "required": [
    "schemaVersion",
    "lockType",
    "platform",
    "images"
  ],
  "properties": {
    "schemaVersion": {
      "const": 1
    },
    "lockType": {
      "const": "image"
    },
    "platform": {
      "const": "linux-amd64"
    },
    "images": {
      "type": "array",
      "minItems": 1,
      "items": {
        "type": "object",
        "additionalProperties": false,
        "required": [
          "id",
          "role",
          "reference",
          "digest",
          "configDigest",
          "platform",
          "sourceUrl"
        ],
        "properties": {
          "id": {
            "$ref": "common.schema.json#/$defs/repositoryId"
          },
          "role": {
            "enum": [
              "builder",
              "runtime",
              "buildkit",
              "dockerfile-frontend"
            ]
          },
          "reference": {
            "type": "string",
            "pattern": "^(?:[a-z0-9]+(?:[._-][a-z0-9]+)*(?::[0-9]+)?/)*[a-z0-9]+(?:[._-][a-z0-9]+)*(?::[A-Za-z0-9_][A-Za-z0-9_.-]{0,127})?$"
          },
          "digest": {
            "$ref": "common.schema.json#/$defs/ociDigest"
          },
          "configDigest": {
            "$ref": "common.schema.json#/$defs/ociDigest"
          },
          "platform": {
            "const": "linux/amd64"
          },
          "sourceUrl": {
            "$ref": "common.schema.json#/$defs/httpsUri"
          }
        }
      }
    }
  }
}
